{
  "schemaVersion": 1,
  "id": "arxiv-2609.20050",
  "arxivId": "2609.20050",
  "version": 2,
  "title": "The Missing Complement: State-Conditioned Minimal Sufficient Evidence for Coding Agents",
  "paperUrl": "https://arxiv.org/abs/2609.20050v2",
  "assessedAt": "2026-09-29T08:35:06Z",
  "policyVersion": 5,
  "policyHash": "659a5d53211b260861c9470a895f51e7858b819ececec695c67b89390a51c85c",
  "materialHash": "d2121089f048d6dd41713c29b1015bd73d9da22aa639107161693771a60a1bfa",
  "materialScope": "abstract_and_arxiv_metadata",
  "decision": "excluded",
  "score": 4,
  "scoreMax": 11,
  "reasons": [
    "未找到 LLM / Agent 评测对象与基准主题的共同证据"
  ],
  "missingSignals": [
    "明确提出新的评测资料或框架",
    "描述任务、问题或评测环境",
    "报告基线或多个模型的评测",
    "给出任务规模或覆盖范围",
    "讨论泛化、污染、稳健性或人工核验"
  ],
  "evidence": [
    {
      "signal": "evaluation_protocol",
      "label": "描述评分指标或评测协议",
      "weight": 2,
      "excerpt": "SERBench measures this on 500 held-out states from 45 repositories, recording what the agent has seen, crediting only sets that satisfy every annotated evidence requirement of the current decision, and separating set recovery from candidate discovery.",
      "source": "abstract",
      "sourceUrl": "https://arxiv.org/abs/2609.20050v2"
    },
    {
      "signal": "resource_link",
      "label": "材料中提供代码或数据链接（未核验内容）",
      "weight": 2,
      "excerpt": "https://github.com/LordTARN1SHED/SERBench",
      "source": "arxiv_comment",
      "sourceUrl": "https://arxiv.org/abs/2609.20050v2"
    }
  ],
  "resourceCandidates": [
    "https://github.com/LordTARN1SHED/SERBench"
  ],
  "declaredVenue": "32 pages, 3 figures. Benchmark and evaluation resources: https://github.com/LordTARN1SHED/SERBench",
  "venueVerified": false,
  "qualityVerified": false
}
