{
  "schemaVersion": 1,
  "id": "arxiv-2609.30313",
  "arxivId": "2609.30313",
  "version": 1,
  "title": "HyQDB: LLM-Assisted Debugging for Hybrid Quantum Workflows",
  "paperUrl": "https://arxiv.org/abs/2609.30313v1",
  "assessedAt": "2026-09-29T16:33:57Z",
  "policyVersion": 5,
  "policyHash": "659a5d53211b260861c9470a895f51e7858b819ececec695c67b89390a51c85c",
  "materialHash": "154715a15509ee4d3f5eaa6ea5e826afc626b507b1873d8a335d710ad469cb3e",
  "materialScope": "abstract_and_arxiv_metadata",
  "decision": "needs_evidence",
  "score": 5,
  "scoreMax": 11,
  "reasons": [
    "摘要级证据不足以自动收录，保留材料等待补充"
  ],
  "missingSignals": [
    "描述任务、问题或评测环境",
    "报告基线或多个模型的评测",
    "材料中提供代码或数据链接（未核验内容）",
    "给出任务规模或覆盖范围",
    "讨论泛化、污染、稳健性或人工核验"
  ],
  "evidence": [
    {
      "signal": "benchmark_contribution",
      "label": "明确提出新的评测资料或框架",
      "weight": 3,
      "excerpt": "To evaluate HyQDB, we introduce QFaultBench, a benchmark built from an expert-derived fault taxonomy that represents the true failure modes of hybrid programs.",
      "source": "abstract",
      "sourceUrl": "https://arxiv.org/abs/2609.30313v1"
    },
    {
      "signal": "evaluation_protocol",
      "label": "描述评分指标或评测协议",
      "weight": 2,
      "excerpt": "On a held-out set of human-authored programs, HyQDB raises repair success over a standard LLM from 45% to 75%.",
      "source": "abstract",
      "sourceUrl": "https://arxiv.org/abs/2609.30313v1"
    }
  ],
  "resourceCandidates": [],
  "declaredVenue": null,
  "venueVerified": false,
  "qualityVerified": false
}
