{
  "schemaVersion": 1,
  "id": "arxiv-2610.08526",
  "arxivId": "2610.08526",
  "version": 1,
  "title": "WareFly-VLA: A Vision-Language-Action Framework for UAV Navigation and Human Tracking in Smart Warehouses",
  "paperUrl": "https://arxiv.org/abs/2610.08526v1",
  "assessedAt": "2026-10-07T17:28:25Z",
  "policyVersion": 5,
  "policyHash": "659a5d53211b260861c9470a895f51e7858b819ececec695c67b89390a51c85c",
  "materialHash": "2911fe8d670da993f416c3616ede72df06ab4e5fa336821a1c94974709ef218c",
  "materialScope": "abstract_and_arxiv_metadata",
  "decision": "excluded",
  "score": 5,
  "scoreMax": 11,
  "reasons": [
    "未找到 LLM / Agent 评测对象与基准主题的共同证据"
  ],
  "missingSignals": [
    "明确提出新的评测资料或框架",
    "材料中提供代码或数据链接（未核验内容）",
    "给出任务规模或覆盖范围"
  ],
  "evidence": [
    {
      "signal": "task_definition",
      "label": "描述任务、问题或评测环境",
      "weight": 1,
      "excerpt": "Two aerial tasks are covered: target approach and person following, under occlusion, long-range search, altitude variation, and clutter.",
      "source": "abstract",
      "sourceUrl": "https://arxiv.org/abs/2610.08526v1"
    },
    {
      "signal": "evaluation_protocol",
      "label": "描述评分指标或评测协议",
      "weight": 2,
      "excerpt": "The dataset, baselines, and evaluation protocol are released to support language-grounded aerial autonomy in smart warehouses.",
      "source": "abstract",
      "sourceUrl": "https://arxiv.org/abs/2610.08526v1"
    },
    {
      "signal": "baseline_comparison",
      "label": "报告基线或多个模型的评测",
      "weight": 1,
      "excerpt": "The dataset, baselines, and evaluation protocol are released to support language-grounded aerial autonomy in smart warehouses.",
      "source": "abstract",
      "sourceUrl": "https://arxiv.org/abs/2610.08526v1"
    },
    {
      "signal": "validity_analysis",
      "label": "讨论泛化、污染、稳健性或人工核验",
      "weight": 1,
      "excerpt": "The results show that language-conditioned aerial control in warehouses is far from solved: performance drops substantially under strict generalization settings, continuous action modeling consistently outperforms discrete action tokenization, only the forward channel is reliably learnable from a single frame, and current foundation-model interfaces transfer poorly from ground and humanoid embodiments to aerial platforms.",
      "source": "abstract",
      "sourceUrl": "https://arxiv.org/abs/2610.08526v1"
    }
  ],
  "resourceCandidates": [],
  "declaredVenue": "41 pages, 35 figures, 11 tables",
  "venueVerified": false,
  "qualityVerified": false
}
