{
  "schemaVersion": 1,
  "id": "arxiv-2609.18123",
  "arxivId": "2609.18123",
  "version": 1,
  "title": "AutoTuneBench: Trustworthy Measurement for Agent Auto-Tuning of LLM Serving Engines",
  "paperUrl": "https://arxiv.org/abs/2609.18123v1",
  "assessedAt": "2026-09-29T08:35:06Z",
  "policyVersion": 5,
  "policyHash": "659a5d53211b260861c9470a895f51e7858b819ececec695c67b89390a51c85c",
  "materialHash": "bc707df00614b6b11efb8146ba7b1cd5918b982766fbf24227f0b00ea1389510",
  "materialScope": "abstract_and_arxiv_metadata",
  "decision": "needs_evidence",
  "score": 7,
  "scoreMax": 11,
  "reasons": [
    "摘要级证据不足以自动收录，保留材料等待补充"
  ],
  "missingSignals": [
    "描述评分指标或评测协议",
    "给出任务规模或覆盖范围",
    "讨论泛化、污染、稳健性或人工核验"
  ],
  "evidence": [
    {
      "signal": "benchmark_contribution",
      "label": "明确提出新的评测资料或框架",
      "weight": 3,
      "excerpt": "We present AutoTuneBench, a benchmark and measurement protocol that makes trust architectural.",
      "source": "abstract",
      "sourceUrl": "https://arxiv.org/abs/2609.18123v1"
    },
    {
      "signal": "task_definition",
      "label": "描述任务、问题或评测环境",
      "weight": 1,
      "excerpt": "We characterize four failure modes from a four-day pilot corpus of 619 model calls: strawman baselines manufacture speedups, absolute times do not transfer across machines, saturated tasks nullify comparisons, and infrastructure defects impersonate science.",
      "source": "abstract",
      "sourceUrl": "https://arxiv.org/abs/2609.18123v1"
    },
    {
      "signal": "baseline_comparison",
      "label": "报告基线或多个模型的评测",
      "weight": 1,
      "excerpt": "We characterize four failure modes from a four-day pilot corpus of 619 model calls: strawman baselines manufacture speedups, absolute times do not transfer across machines, saturated tasks nullify comparisons, and infrastructure defects impersonate science.",
      "source": "abstract",
      "sourceUrl": "https://arxiv.org/abs/2609.18123v1"
    },
    {
      "signal": "resource_link",
      "label": "材料中提供代码或数据链接（未核验内容）",
      "weight": 2,
      "excerpt": "https://github.com/li-ch/autotunebench",
      "source": "arxiv_comment",
      "sourceUrl": "https://arxiv.org/abs/2609.18123v1"
    }
  ],
  "resourceCandidates": [
    "https://github.com/li-ch/autotunebench"
  ],
  "declaredVenue": "15 pages, 7 tables, 6 figures. Code and measurement corpus: https://github.com/li-ch/autotunebench (tag v1.0.0)",
  "venueVerified": false,
  "qualityVerified": false
}
