{
  "schemaVersion": 1,
  "id": "arxiv-2609.32720",
  "arxivId": "2609.32720",
  "version": 1,
  "title": "BiasReducer: Adaptive Bias Mitigation for Reward Models",
  "paperUrl": "https://arxiv.org/abs/2609.32720v1",
  "assessedAt": "2026-09-29T16:33:57Z",
  "policyVersion": 5,
  "policyHash": "659a5d53211b260861c9470a895f51e7858b819ececec695c67b89390a51c85c",
  "materialHash": "90d17bac51f7dc196e4b1d44dafaf658776133f77ae05e11e3cc15e731371f50",
  "materialScope": "abstract_and_arxiv_metadata",
  "decision": "needs_evidence",
  "score": 4,
  "scoreMax": 11,
  "reasons": [
    "摘要级证据不足以自动收录，保留材料等待补充"
  ],
  "missingSignals": [
    "明确提出新的评测资料或框架",
    "描述任务、问题或评测环境",
    "材料中提供代码或数据链接（未核验内容）",
    "给出任务规模或覆盖范围"
  ],
  "evidence": [
    {
      "signal": "evaluation_protocol",
      "label": "描述评分指标或评测协议",
      "weight": 2,
      "excerpt": "However, reward models can favor superficial attributes such as length or confidence, leading LLMs to produce higher-scoring but not more correct responses.",
      "source": "abstract",
      "sourceUrl": "https://arxiv.org/abs/2609.32720v1"
    },
    {
      "signal": "baseline_comparison",
      "label": "报告基线或多个模型的评测",
      "weight": 1,
      "excerpt": "Across five reward models, BiasReducer-M improves the three benchmarks by 8.3, 18.0, and 6.9 percentage points on average, outperforming the two training-based baselines.",
      "source": "abstract",
      "sourceUrl": "https://arxiv.org/abs/2609.32720v1"
    },
    {
      "signal": "validity_analysis",
      "label": "讨论泛化、污染、稳健性或人工核验",
      "weight": 1,
      "excerpt": "BiasReducer consistently improves reward-model robustness to biases toward superficial response attributes.",
      "source": "abstract",
      "sourceUrl": "https://arxiv.org/abs/2609.32720v1"
    }
  ],
  "resourceCandidates": [],
  "declaredVenue": null,
  "venueVerified": false,
  "qualityVerified": false
}
