{
  "schemaVersion": 1,
  "id": "arxiv-2610.21477",
  "arxivId": "2610.21477",
  "version": 1,
  "title": "Tool-Augmented Large Language Models for Reliable Medical Calculation from Patient Notes",
  "paperUrl": "https://arxiv.org/abs/2610.21477v1",
  "assessedAt": "2026-10-16T07:14:30Z",
  "policyVersion": 5,
  "policyHash": "659a5d53211b260861c9470a895f51e7858b819ececec695c67b89390a51c85c",
  "materialHash": "6a08065de3d4681b830db4ec4a5d091b504c6d0b07f992bead75c310b24cbd69",
  "materialScope": "abstract_and_arxiv_metadata",
  "decision": "excluded",
  "score": 3,
  "scoreMax": 11,
  "reasons": [
    "医学、生物医学或临床专题，超出当前 Agent 与通用模型评测方向"
  ],
  "missingSignals": [
    "明确提出新的评测资料或框架",
    "描述任务、问题或评测环境",
    "材料中提供代码或数据链接（未核验内容）",
    "给出任务规模或覆盖范围",
    "讨论泛化、污染、稳健性或人工核验"
  ],
  "evidence": [
    {
      "signal": "evaluation_protocol",
      "label": "描述评分指标或评测协议",
      "weight": 2,
      "excerpt": "However, applying these calculators directly to free-form patient notes requires precise variable extraction combined with the exact execution of complex formulas, scoring rules, and output conventions.",
      "source": "abstract",
      "sourceUrl": "https://arxiv.org/abs/2610.21477v1"
    },
    {
      "signal": "baseline_comparison",
      "label": "报告基线或多个模型的评测",
      "weight": 1,
      "excerpt": "Evaluated on the MedCalc-Bench dataset, our method achieves 86.73% final-answer accuracy, outperforming the one-shot prompting and supervised fine tuning-only baselines by 24.0 and 17.27 percentage points.",
      "source": "abstract",
      "sourceUrl": "https://arxiv.org/abs/2610.21477v1"
    }
  ],
  "resourceCandidates": [],
  "declaredVenue": "Accepted as a regular paper at BIBM2026",
  "venueVerified": false,
  "qualityVerified": false
}
