{
  "schemaVersion": 1,
  "id": "arxiv-2610.15107",
  "arxivId": "2610.15107",
  "version": 1,
  "title": "Structural Chain-of-Thought: Reasoning with Executable Computational Graphs",
  "paperUrl": "https://arxiv.org/abs/2610.15107v1",
  "assessedAt": "2026-10-15T07:30:10Z",
  "policyVersion": 5,
  "policyHash": "659a5d53211b260861c9470a895f51e7858b819ececec695c67b89390a51c85c",
  "materialHash": "6afc1d92b7ae2240e5445fa569258b66bb59f18cb3ecfee74b391f3c7b958c42",
  "materialScope": "abstract_and_arxiv_metadata",
  "decision": "needs_evidence",
  "score": 3,
  "scoreMax": 11,
  "reasons": [
    "摘要级证据不足以自动收录，保留材料等待补充"
  ],
  "missingSignals": [
    "明确提出新的评测资料或框架",
    "描述任务、问题或评测环境",
    "材料中提供代码或数据链接（未核验内容）",
    "给出任务规模或覆盖范围",
    "讨论泛化、污染、稳健性或人工核验"
  ],
  "evidence": [
    {
      "signal": "evaluation_protocol",
      "label": "描述评分指标或评测协议",
      "weight": 2,
      "excerpt": "The model is trained using graph-based reinforcement learning that rewards structural validity, answer correctness, and node overlap with reference graphs.",
      "source": "abstract",
      "sourceUrl": "https://arxiv.org/abs/2610.15107v1"
    },
    {
      "signal": "baseline_comparison",
      "label": "报告基线或多个模型的评测",
      "weight": 1,
      "excerpt": "Experiments across five benchmarks and four model families show that our method consistently improves accuracy over supervised graph training and can reduce generation length by up to 5-6x compared with standard GRPO and chain-of-thought supervised training.",
      "source": "abstract",
      "sourceUrl": "https://arxiv.org/abs/2610.15107v1"
    }
  ],
  "resourceCandidates": [],
  "declaredVenue": null,
  "venueVerified": false,
  "qualityVerified": false
}
