{
  "schemaVersion": 1,
  "id": "arxiv-2609.34041",
  "arxivId": "2609.34041",
  "version": 1,
  "title": "Vision--Language Signals in Constrained RL: Safety Gains Without Anticipation",
  "paperUrl": "https://arxiv.org/abs/2609.34041v1",
  "assessedAt": "2026-09-29T16:33:57Z",
  "policyVersion": 5,
  "policyHash": "659a5d53211b260861c9470a895f51e7858b819ececec695c67b89390a51c85c",
  "materialHash": "362fae89b041f63cca6c59dd110fe3832f5bc583dd9f126ec576e1e7508d7717",
  "materialScope": "abstract_and_arxiv_metadata",
  "decision": "needs_evidence",
  "score": 1,
  "scoreMax": 11,
  "reasons": [
    "摘要级证据不足以自动收录，保留材料等待补充"
  ],
  "missingSignals": [
    "明确提出新的评测资料或框架",
    "描述评分指标或评测协议",
    "报告基线或多个模型的评测",
    "材料中提供代码或数据链接（未核验内容）",
    "给出任务规模或覆盖范围",
    "讨论泛化、污染、稳健性或人工核验"
  ],
  "evidence": [
    {
      "signal": "task_definition",
      "label": "描述任务、问题或评测环境",
      "weight": 1,
      "excerpt": "Safe reinforcement learning seeks policies that maximise task performance while satisfying safety constraints.",
      "source": "abstract",
      "sourceUrl": "https://arxiv.org/abs/2609.34041v1"
    }
  ],
  "resourceCandidates": [],
  "declaredVenue": null,
  "venueVerified": false,
  "qualityVerified": false
}
