{
  "schemaVersion": 1,
  "id": "arxiv-2610.40518",
  "arxivId": "2610.40518",
  "version": 1,
  "title": "IndicIPR-QA: A Benchmark for Extractive Question Answering on Indian IPR Laws",
  "paperUrl": "https://arxiv.org/abs/2610.40518v1",
  "assessedAt": "2026-10-30T16:43:45Z",
  "policyVersion": 5,
  "policyHash": "659a5d53211b260861c9470a895f51e7858b819ececec695c67b89390a51c85c",
  "materialHash": "95249f17f49feeeabf3c49e70873fd8ab9938a8aab4fc13a384279ead7efa13c",
  "materialScope": "abstract_and_arxiv_metadata",
  "decision": "needs_evidence",
  "score": 4,
  "scoreMax": 11,
  "reasons": [
    "摘要级证据不足以自动收录，保留材料等待补充"
  ],
  "missingSignals": [
    "描述评分指标或评测协议",
    "报告基线或多个模型的评测",
    "材料中提供代码或数据链接（未核验内容）",
    "给出任务规模或覆盖范围",
    "讨论泛化、污染、稳健性或人工核验"
  ],
  "evidence": [
    {
      "signal": "benchmark_contribution",
      "label": "明确提出新的评测资料或框架",
      "weight": 3,
      "excerpt": "This paper presents IndicIPR-QA1, an extractive QA benchmark for Indian IPR laws.",
      "source": "abstract",
      "sourceUrl": "https://arxiv.org/abs/2610.40518v1"
    },
    {
      "signal": "task_definition",
      "label": "描述任务、问题或评测环境",
      "weight": 1,
      "excerpt": "Legal Question Answering (QA) over statutory texts is a challenging task in Natural Language Processing (NLP), especially in low-resource settings with complex legal systems.",
      "source": "abstract",
      "sourceUrl": "https://arxiv.org/abs/2610.40518v1"
    }
  ],
  "resourceCandidates": [],
  "declaredVenue": null,
  "venueVerified": false,
  "qualityVerified": false
}
