{
  "schemaVersion": 1,
  "id": "arxiv-2610.40476",
  "arxivId": "2610.40476",
  "version": 1,
  "title": "Training language models in simulation for psychiatric intake",
  "paperUrl": "https://arxiv.org/abs/2610.40476v1",
  "assessedAt": "2026-10-30T16:43:45Z",
  "policyVersion": 5,
  "policyHash": "659a5d53211b260861c9470a895f51e7858b819ececec695c67b89390a51c85c",
  "materialHash": "4ace39ea3e1eb4c838acfc1ea394fd58cd6e2e4e533a5c05c384849e4ca06aa2",
  "materialScope": "abstract_and_arxiv_metadata",
  "decision": "needs_evidence",
  "score": 1,
  "scoreMax": 11,
  "reasons": [
    "摘要级证据不足以自动收录，保留材料等待补充"
  ],
  "missingSignals": [
    "明确提出新的评测资料或框架",
    "描述任务、问题或评测环境",
    "描述评分指标或评测协议",
    "材料中提供代码或数据链接（未核验内容）",
    "给出任务规模或覆盖范围",
    "讨论泛化、污染、稳健性或人工核验"
  ],
  "evidence": [
    {
      "signal": "baseline_comparison",
      "label": "报告基线或多个模型的评测",
      "weight": 1,
      "excerpt": "In a randomized, double-blind crossover study ($N = 60$ matched scenario pairs, 120 encounters) comparing the RL-trained agent against its identically prompted base model, 32 board-certified psychiatrists role-played standardized patients while a separate panel of 15 independent, board-certified psychiatrists scored the de-identified transcripts.",
      "source": "abstract",
      "sourceUrl": "https://arxiv.org/abs/2610.40476v1"
    }
  ],
  "resourceCandidates": [],
  "declaredVenue": "76 pages, 8 figures, 15 tables (27 pages main text, 7 main figures, 2 main tables)",
  "venueVerified": false,
  "qualityVerified": false
}
