{
  "schemaVersion": 1,
  "id": "arxiv-2610.31355",
  "arxivId": "2610.31355",
  "version": 1,
  "title": "Muffin - A Shared Memory Buffer for Asynchronous AI Agents",
  "paperUrl": "https://arxiv.org/abs/2610.31355v1",
  "assessedAt": "2026-10-23T07:36:00Z",
  "policyVersion": 5,
  "policyHash": "659a5d53211b260861c9470a895f51e7858b819ececec695c67b89390a51c85c",
  "materialHash": "00faa56c868cfe5697007ce88d00e865bc5f342d0d622ee21af9f45a8264e23f",
  "materialScope": "abstract_and_arxiv_metadata",
  "decision": "excluded",
  "score": 3,
  "scoreMax": 11,
  "reasons": [
    "未找到 LLM / Agent 评测对象与基准主题的共同证据"
  ],
  "missingSignals": [
    "明确提出新的评测资料或框架",
    "报告基线或多个模型的评测",
    "材料中提供代码或数据链接（未核验内容）",
    "给出任务规模或覆盖范围",
    "讨论泛化、污染、稳健性或人工核验"
  ],
  "evidence": [
    {
      "signal": "task_definition",
      "label": "描述任务、问题或评测环境",
      "weight": 1,
      "excerpt": "However, in target-driven reasoning tasks, single- and multi-agent systems are often on par in terms of performance gains.",
      "source": "abstract",
      "sourceUrl": "https://arxiv.org/abs/2610.31355v1"
    },
    {
      "signal": "evaluation_protocol",
      "label": "描述评分指标或评测协议",
      "weight": 2,
      "excerpt": "Our experiments show that our framework Muffin outperforms established competitors, achieving the best accuracy in 17 out of 20 of our benchmark settings, and provides a better quality-cost trade-off than multi-agent debate: Muffin improves accuracy by 19.2 accuracy points while using 77.4% fewer tokens, without requiring full-trace sharing.",
      "source": "abstract",
      "sourceUrl": "https://arxiv.org/abs/2610.31355v1"
    }
  ],
  "resourceCandidates": [],
  "declaredVenue": null,
  "venueVerified": false,
  "qualityVerified": false
}
