{
  "schemaVersion": 1,
  "id": "arxiv-2609.11515",
  "arxivId": "2609.11515",
  "version": 2,
  "title": "ChurnBench: A Drift-Aware Benchmark Demonstrating That Refresh Scheduling, Not Cache Age, Governs Staleness in Agentic AI",
  "paperUrl": "https://arxiv.org/abs/2609.11515v2",
  "assessedAt": "2026-09-29T08:35:06Z",
  "policyVersion": 5,
  "policyHash": "659a5d53211b260861c9470a895f51e7858b819ececec695c67b89390a51c85c",
  "materialHash": "92efd63d60b14997e933855624e90da123dc0cd4722b17574600504af1ff9e28",
  "materialScope": "abstract_and_arxiv_metadata",
  "decision": "excluded",
  "score": 6,
  "scoreMax": 11,
  "reasons": [
    "未找到 LLM / Agent 评测对象与基准主题的共同证据"
  ],
  "missingSignals": [
    "描述评分指标或评测协议",
    "报告基线或多个模型的评测",
    "给出任务规模或覆盖范围",
    "讨论泛化、污染、稳健性或人工核验"
  ],
  "evidence": [
    {
      "signal": "benchmark_contribution",
      "label": "明确提出新的评测资料或框架",
      "weight": 3,
      "excerpt": "We present ChurnBench, an open-source benchmark that generates a four-source enterprise data fabric as a timeline rather than a snapshot.",
      "source": "abstract",
      "sourceUrl": "https://arxiv.org/abs/2609.11515v2"
    },
    {
      "signal": "task_definition",
      "label": "描述任务、问题或评测环境",
      "weight": 1,
      "excerpt": "In production, agentic systems answer questions over data that lives in several places and keeps changing: licenses are reassigned, users offboarded, prices changed, contracts renewed.",
      "source": "abstract",
      "sourceUrl": "https://arxiv.org/abs/2609.11515v2"
    },
    {
      "signal": "resource_link",
      "label": "材料中提供代码或数据链接（未核验内容）",
      "weight": 2,
      "excerpt": "https://github.com/vsingh45/churnbench",
      "source": "arxiv_comment",
      "sourceUrl": "https://arxiv.org/abs/2609.11515v2"
    }
  ],
  "resourceCandidates": [
    "https://github.com/vsingh45/churnbench"
  ],
  "declaredVenue": "8 pages, 2 figures, 5 tables. Code, data, and evaluation harness in github: https://github.com/vsingh45/churnbench",
  "venueVerified": false,
  "qualityVerified": false
}
