{
  "schemaVersion": 1,
  "id": "arxiv-2609.38743",
  "arxivId": "2609.38743",
  "version": 2,
  "title": "Learning to Route in Visual Space via Multi-Step Embedding Retrieval",
  "paperUrl": "https://arxiv.org/abs/2609.38743v2",
  "assessedAt": "2026-10-05T09:08:45Z",
  "policyVersion": 5,
  "policyHash": "659a5d53211b260861c9470a895f51e7858b819ececec695c67b89390a51c85c",
  "materialHash": "152ad6e8e7339a80bcdcb8a38a474c606fc98cdaa469a76c1dab66fe0ec61192",
  "materialScope": "abstract_and_arxiv_metadata",
  "decision": "needs_evidence",
  "score": 5,
  "scoreMax": 11,
  "reasons": [
    "摘要级证据不足以自动收录，保留材料等待补充"
  ],
  "missingSignals": [
    "描述评分指标或评测协议",
    "材料中提供代码或数据链接（未核验内容）",
    "给出任务规模或覆盖范围",
    "讨论泛化、污染、稳健性或人工核验"
  ],
  "evidence": [
    {
      "signal": "benchmark_contribution",
      "label": "明确提出新的评测资料或框架",
      "weight": 3,
      "excerpt": "To study this systematically, we introduce VHOP, a flexible data generation framework and benchmark with five core difficulty levels testing both visual matching and search planning.",
      "source": "abstract",
      "sourceUrl": "https://arxiv.org/abs/2609.38743v2"
    },
    {
      "signal": "task_definition",
      "label": "描述任务、问题或评测环境",
      "weight": 1,
      "excerpt": "In agentic search, it improves task success rates by 52.7\\% and reduces the average token length by 61\\% from 1886 to 728, whereas upgrading the agent yields only a 3.7\\% gain.",
      "source": "abstract",
      "sourceUrl": "https://arxiv.org/abs/2609.38743v2"
    },
    {
      "signal": "baseline_comparison",
      "label": "报告基线或多个模型的评测",
      "weight": 1,
      "excerpt": "Compared to a strong baseline where the agent retrieves the top 50 results per step, VHOP-Router maintains superior performance while reducing in-context images by $23\\times$ and cutting the cumulative API payload by $35\\times$.",
      "source": "abstract",
      "sourceUrl": "https://arxiv.org/abs/2609.38743v2"
    }
  ],
  "resourceCandidates": [],
  "declaredVenue": null,
  "venueVerified": false,
  "qualityVerified": false
}
