{
  "schemaVersion": 1,
  "id": "arxiv-2610.22019",
  "arxivId": "2610.22019",
  "version": 1,
  "title": "Priming Base Models for Agentic Post-Training: An Open Midtraining Recipe",
  "paperUrl": "https://arxiv.org/abs/2610.22019v1",
  "assessedAt": "2026-10-16T07:14:30Z",
  "policyVersion": 5,
  "policyHash": "659a5d53211b260861c9470a895f51e7858b819ececec695c67b89390a51c85c",
  "materialHash": "596b5c8bacb9fd30370c332145e6fc2005408c4ec2d1cae44817a39f64a5a8df",
  "materialScope": "abstract_and_arxiv_metadata",
  "decision": "excluded",
  "score": 4,
  "scoreMax": 11,
  "reasons": [
    "未找到 LLM / Agent 评测对象与基准主题的共同证据"
  ],
  "missingSignals": [
    "明确提出新的评测资料或框架",
    "报告基线或多个模型的评测",
    "材料中提供代码或数据链接（未核验内容）",
    "给出任务规模或覆盖范围"
  ],
  "evidence": [
    {
      "signal": "task_definition",
      "label": "描述任务、问题或评测环境",
      "weight": 1,
      "excerpt": "On the larger Nemotron 3.5 Super, 280B midtraining tokens improve DeepSWE, a harder benchmark of long-horizon tasks, from 11.7 to 15.7 and SWE-bench Verified from 72.9 to 74.3 after identical full SFT.",
      "source": "abstract",
      "sourceUrl": "https://arxiv.org/abs/2610.22019v1"
    },
    {
      "signal": "evaluation_protocol",
      "label": "描述评分指标或评测协议",
      "weight": 2,
      "excerpt": "We report the ablations behind the recipe and an evaluation protocol built on short fixed SFT runs, since base-model proxy metrics did not correlate reliably with post-training results.",
      "source": "abstract",
      "sourceUrl": "https://arxiv.org/abs/2610.22019v1"
    },
    {
      "signal": "validity_analysis",
      "label": "讨论泛化、污染、稳健性或人工核验",
      "weight": 1,
      "excerpt": "Midtraining also improves robustness across agent harnesses on both models.",
      "source": "abstract",
      "sourceUrl": "https://arxiv.org/abs/2610.22019v1"
    }
  ],
  "resourceCandidates": [],
  "declaredVenue": "19 pages",
  "venueVerified": false,
  "qualityVerified": false
}
