{
  "schemaVersion": 1,
  "id": "arxiv-2610.05033",
  "arxivId": "2610.05033",
  "version": 1,
  "title": "Code2Games: Enabling Coding Agents for Gaming World Generation",
  "paperUrl": "https://arxiv.org/abs/2610.05033v1",
  "assessedAt": "2026-10-06T09:02:52Z",
  "policyVersion": 5,
  "policyHash": "659a5d53211b260861c9470a895f51e7858b819ececec695c67b89390a51c85c",
  "materialHash": "a6e82364387c2e34337ab6616bbbca6b49948cfc86926226bcf0307b097ce947",
  "materialScope": "abstract_and_arxiv_metadata",
  "decision": "excluded",
  "score": 6,
  "scoreMax": 11,
  "reasons": [
    "未找到 LLM / Agent 评测对象与基准主题的共同证据"
  ],
  "missingSignals": [
    "描述任务、问题或评测环境",
    "描述评分指标或评测协议",
    "给出任务规模或覆盖范围",
    "讨论泛化、污染、稳健性或人工核验"
  ],
  "evidence": [
    {
      "signal": "benchmark_contribution",
      "label": "明确提出新的评测资料或框架",
      "weight": 3,
      "excerpt": "To systematically evaluate gaming-world generation, we introduce the GameCode4D benchmark, which comprises ten fixed game prompts spanning different levels of scene and gameplay complexity.",
      "source": "abstract",
      "sourceUrl": "https://arxiv.org/abs/2610.05033v1"
    },
    {
      "signal": "baseline_comparison",
      "label": "报告基线或多个模型的评测",
      "weight": 1,
      "excerpt": "Experiments demonstrate that, compared with direct gaming-world generation by coding agents and existing baseline methods, Code2Games consistently improves the visual quality and interactive fidelity of generated gaming worlds, as well as the quality of the resulting games after engine adaptation.",
      "source": "abstract",
      "sourceUrl": "https://arxiv.org/abs/2610.05033v1"
    },
    {
      "signal": "resource_link",
      "label": "材料中提供代码或数据链接（未核验内容）",
      "weight": 2,
      "excerpt": "https://github.com/AIGeeksGroup/Code2Games",
      "source": "arxiv_comment",
      "sourceUrl": "https://arxiv.org/abs/2610.05033v1"
    }
  ],
  "resourceCandidates": [
    "https://github.com/AIGeeksGroup/Code2Games",
    "https://aigeeksgroup.github.io/Code2Games"
  ],
  "declaredVenue": "Code: https://github.com/AIGeeksGroup/Code2Games, Website: https://aigeeksgroup.github.io/Code2Games",
  "venueVerified": false,
  "qualityVerified": false
}
