{
  "schemaVersion": 1,
  "id": "arxiv-2609.26780",
  "arxivId": "2609.26780",
  "version": 2,
  "title": "SpeakerMem-R1: Speaker-Centered Dual-Track Memory for Multi-Party Dialogue",
  "paperUrl": "https://arxiv.org/abs/2609.26780v2",
  "assessedAt": "2026-09-29T16:33:57Z",
  "policyVersion": 5,
  "policyHash": "659a5d53211b260861c9470a895f51e7858b819ececec695c67b89390a51c85c",
  "materialHash": "f5ffce34b0047cf024098d6781c79064393d9e029dd9f348692405aeeead9253",
  "materialScope": "abstract_and_arxiv_metadata",
  "decision": "needs_evidence",
  "score": 6,
  "scoreMax": 11,
  "reasons": [
    "摘要级证据不足以自动收录，保留材料等待补充"
  ],
  "missingSignals": [
    "明确提出新的评测资料或框架",
    "报告基线或多个模型的评测",
    "讨论泛化、污染、稳健性或人工核验"
  ],
  "evidence": [
    {
      "signal": "task_definition",
      "label": "描述任务、问题或评测环境",
      "weight": 1,
      "excerpt": "It also achieves 70.85% on all 1,986 LoCoMo questions, which we use as a two-person long-term conversation boundary test.",
      "source": "abstract",
      "sourceUrl": "https://arxiv.org/abs/2609.26780v2"
    },
    {
      "signal": "evaluation_protocol",
      "label": "描述评分指标或评测协议",
      "weight": 2,
      "excerpt": "In a controlled evaluation of 305 questions, RL raises the SFT Writer's mean accuracy from 57.38% to 68.20%.",
      "source": "abstract",
      "sourceUrl": "https://arxiv.org/abs/2609.26780v2"
    },
    {
      "signal": "scale_or_coverage",
      "label": "给出任务规模或覆盖范围",
      "weight": 1,
      "excerpt": "It also achieves 70.85% on all 1,986 LoCoMo questions, which we use as a two-person long-term conversation boundary test.",
      "source": "abstract",
      "sourceUrl": "https://arxiv.org/abs/2609.26780v2"
    },
    {
      "signal": "resource_link",
      "label": "材料中提供代码或数据链接（未核验内容）",
      "weight": 2,
      "excerpt": "https://2022hpsk.github.io/SpeakerMemR1",
      "source": "arxiv_comment",
      "sourceUrl": "https://arxiv.org/abs/2609.26780v2"
    }
  ],
  "resourceCandidates": [
    "https://2022hpsk.github.io/SpeakerMemR1",
    "https://github.com/2022hpsk/SpeakerMemR1"
  ],
  "declaredVenue": "Project Page: https://2022hpsk.github.io/SpeakerMemR1 , Code: https://github.com/2022hpsk/SpeakerMemR1",
  "venueVerified": false,
  "qualityVerified": false
}
