{
  "schemaVersion": 1,
  "id": "arxiv-2610.08402",
  "arxivId": "2610.08402",
  "version": 1,
  "title": "VETTA: Coordinating Turn- and Token-Level Credit Assignment for Multi-Turn LLM Agents",
  "paperUrl": "https://arxiv.org/abs/2610.08402v1",
  "assessedAt": "2026-10-07T17:28:25Z",
  "policyVersion": 5,
  "policyHash": "659a5d53211b260861c9470a895f51e7858b819ececec695c67b89390a51c85c",
  "materialHash": "cc4057a5961f06bc207b9448cc437d88e7cebad7833a4093d0dbeeddf83f092c",
  "materialScope": "abstract_and_arxiv_metadata",
  "decision": "needs_evidence",
  "score": 3,
  "scoreMax": 11,
  "reasons": [
    "摘要级证据不足以自动收录，保留材料等待补充"
  ],
  "missingSignals": [
    "明确提出新的评测资料或框架",
    "描述评分指标或评测协议",
    "报告基线或多个模型的评测",
    "给出任务规模或覆盖范围",
    "讨论泛化、污染、稳健性或人工核验"
  ],
  "evidence": [
    {
      "signal": "task_definition",
      "label": "描述任务、问题或评测环境",
      "weight": 1,
      "excerpt": "Multi-turn LLM agents often receive sparse task feedback across several interactions, while generating each response token by token.",
      "source": "abstract",
      "sourceUrl": "https://arxiv.org/abs/2610.08402v1"
    },
    {
      "signal": "resource_link",
      "label": "材料中提供代码或数据链接（未核验内容）",
      "weight": 2,
      "excerpt": "https://github.com/Jiaju-Chen/VETTA-official",
      "source": "abstract",
      "sourceUrl": "https://arxiv.org/abs/2610.08402v1"
    }
  ],
  "resourceCandidates": [
    "https://github.com/Jiaju-Chen/VETTA-official"
  ],
  "declaredVenue": "16 pages, 6 figures",
  "venueVerified": false,
  "qualityVerified": false
}
