{
  "schemaVersion": 1,
  "id": "arxiv-2610.10893",
  "arxivId": "2610.10893",
  "version": 1,
  "title": "Less from More: Reinforcing Sparse Video Reasoning from Dense References",
  "paperUrl": "https://arxiv.org/abs/2610.10893v1",
  "assessedAt": "2026-10-09T17:02:04Z",
  "policyVersion": 5,
  "policyHash": "659a5d53211b260861c9470a895f51e7858b819ececec695c67b89390a51c85c",
  "materialHash": "2be1befdcb6f0522e5f7f1a87123267055b2659fa2130a3a12d4688a9799a58b",
  "materialScope": "abstract_and_arxiv_metadata",
  "decision": "needs_evidence",
  "score": 2,
  "scoreMax": 11,
  "reasons": [
    "摘要级证据不足以自动收录，保留材料等待补充"
  ],
  "missingSignals": [
    "明确提出新的评测资料或框架",
    "描述评分指标或评测协议",
    "材料中提供代码或数据链接（未核验内容）",
    "给出任务规模或覆盖范围",
    "讨论泛化、污染、稳健性或人工核验"
  ],
  "evidence": [
    {
      "signal": "task_definition",
      "label": "描述任务、问题或评测环境",
      "weight": 1,
      "excerpt": "We question this assumption and argue that the key challenge is not merely processing more video frames efficiently, but learning to reason reliably under limited temporal evidence.",
      "source": "abstract",
      "sourceUrl": "https://arxiv.org/abs/2610.10893v1"
    },
    {
      "signal": "baseline_comparison",
      "label": "报告基线或多个模型的评测",
      "weight": 1,
      "excerpt": "In particular, SAVER can match or surpass dense-frame Qwen3.5 baselines while using substantially fewer frames.",
      "source": "abstract",
      "sourceUrl": "https://arxiv.org/abs/2610.10893v1"
    }
  ],
  "resourceCandidates": [],
  "declaredVenue": null,
  "venueVerified": false,
  "qualityVerified": false
}
