{
  "schemaVersion": 1,
  "id": "arxiv-2610.28811",
  "arxivId": "2610.28811",
  "version": 1,
  "title": "A Mechanistic Study of Automated Failure Attribution in LLM-based Agentic Systems",
  "paperUrl": "https://arxiv.org/abs/2610.28811v1",
  "assessedAt": "2026-10-22T07:39:00Z",
  "policyVersion": 5,
  "policyHash": "659a5d53211b260861c9470a895f51e7858b819ececec695c67b89390a51c85c",
  "materialHash": "b95183ea2099015525cf8192f4575b816b6b72fd13eb336ed5360b386378dcb8",
  "materialScope": "abstract_and_arxiv_metadata",
  "decision": "excluded",
  "score": 4,
  "scoreMax": 11,
  "reasons": [
    "材料表明提出方法并使用已有基准评估，未见新基准贡献"
  ],
  "missingSignals": [
    "明确提出新的评测资料或框架",
    "描述评分指标或评测协议",
    "给出任务规模或覆盖范围",
    "讨论泛化、污染、稳健性或人工核验"
  ],
  "evidence": [
    {
      "signal": "task_definition",
      "label": "描述任务、问题或评测环境",
      "weight": 1,
      "excerpt": "Agentic systems have demonstrated strong capabilities on complex tasks by enabling multiple interacting large language model (LLM)-based agents to collaborate and execute subtasks in parallel.",
      "source": "abstract",
      "sourceUrl": "https://arxiv.org/abs/2610.28811v1"
    },
    {
      "signal": "baseline_comparison",
      "label": "报告基线或多个模型的评测",
      "weight": 1,
      "excerpt": "Extensive evaluations across multiple LLMs and benchmark settings demonstrate that grafting consistently outperforms direct-prompting approaches, underscoring the potential of leveraging latent model knowledge for more reliable failure attribution.",
      "source": "abstract",
      "sourceUrl": "https://arxiv.org/abs/2610.28811v1"
    },
    {
      "signal": "resource_link",
      "label": "材料中提供代码或数据链接（未核验内容）",
      "weight": 2,
      "excerpt": "https://github.com/wendyzheng22/mi4afa",
      "source": "abstract",
      "sourceUrl": "https://arxiv.org/abs/2610.28811v1"
    }
  ],
  "resourceCandidates": [
    "https://github.com/wendyzheng22/mi4afa"
  ],
  "declaredVenue": null,
  "venueVerified": false,
  "qualityVerified": false
}
