{
  "schemaVersion": 1,
  "id": "arxiv-2609.32413",
  "arxivId": "2609.32413",
  "version": 1,
  "title": "IChart2Code: Benchmarking Multimodal Large Language Models for Interactive Chart Code Generation",
  "paperUrl": "https://arxiv.org/abs/2609.32413v1",
  "assessedAt": "2026-09-29T16:33:57Z",
  "policyVersion": 5,
  "policyHash": "659a5d53211b260861c9470a895f51e7858b819ececec695c67b89390a51c85c",
  "materialHash": "ba6eed658658a19cece63d159cdcf585822af96eae516f33b5ee7b90d432adb9",
  "materialScope": "abstract_and_arxiv_metadata",
  "decision": "needs_evidence",
  "score": 7,
  "scoreMax": 11,
  "reasons": [
    "摘要级证据不足以自动收录，保留材料等待补充"
  ],
  "missingSignals": [
    "报告基线或多个模型的评测",
    "材料中提供代码或数据链接（未核验内容）",
    "讨论泛化、污染、稳健性或人工核验"
  ],
  "evidence": [
    {
      "signal": "benchmark_contribution",
      "label": "明确提出新的评测资料或框架",
      "weight": 3,
      "excerpt": "We introduce IChart2Code, a benchmark comprising 377 tasks across 20 chart forms and 13 data families, with 1209 interaction requirements in six families.",
      "source": "abstract",
      "sourceUrl": "https://arxiv.org/abs/2609.32413v1"
    },
    {
      "signal": "task_definition",
      "label": "描述任务、问题或评测环境",
      "weight": 1,
      "excerpt": "Interactive chart code generation requires models to reproduce a reference chart's appearance and underlying data and correctly implement the state changes triggered by specified user interactions.",
      "source": "abstract",
      "sourceUrl": "https://arxiv.org/abs/2609.32413v1"
    },
    {
      "signal": "evaluation_protocol",
      "label": "描述评分指标或评测协议",
      "weight": 2,
      "excerpt": "We further develop a browser-based evaluation protocol with an Executability gate and three rubric-guided dimensions: Data Fidelity, Static Visual Correctness, and Interaction Correctness.",
      "source": "abstract",
      "sourceUrl": "https://arxiv.org/abs/2609.32413v1"
    },
    {
      "signal": "scale_or_coverage",
      "label": "给出任务规模或覆盖范围",
      "weight": 1,
      "excerpt": "We introduce IChart2Code, a benchmark comprising 377 tasks across 20 chart forms and 13 data families, with 1209 interaction requirements in six families.",
      "source": "abstract",
      "sourceUrl": "https://arxiv.org/abs/2609.32413v1"
    }
  ],
  "resourceCandidates": [],
  "declaredVenue": "9 pages, 3 figures, 5 tables",
  "venueVerified": false,
  "qualityVerified": false
}
