{
  "schemaVersion": 1,
  "id": "arxiv-2610.17654",
  "arxivId": "2610.17654",
  "version": 1,
  "title": "Decouple to Forget: Semantic Mediation for Sensitive Unlearning in Large Language Models",
  "paperUrl": "https://arxiv.org/abs/2610.17654v1",
  "assessedAt": "2026-10-15T07:30:10Z",
  "policyVersion": 5,
  "policyHash": "659a5d53211b260861c9470a895f51e7858b819ececec695c67b89390a51c85c",
  "materialHash": "45860ebf9d57dd6cd0cf8fb0e392bc9f88a7f07622a6018929e2a4d940e18275",
  "materialScope": "abstract_and_arxiv_metadata",
  "decision": "excluded",
  "score": 3,
  "scoreMax": 11,
  "reasons": [
    "材料表明提出方法并使用已有基准评估，未见新基准贡献"
  ],
  "missingSignals": [
    "明确提出新的评测资料或框架",
    "描述任务、问题或评测环境",
    "描述评分指标或评测协议",
    "给出任务规模或覆盖范围",
    "讨论泛化、污染、稳健性或人工核验"
  ],
  "evidence": [
    {
      "signal": "baseline_comparison",
      "label": "报告基线或多个模型的评测",
      "weight": 1,
      "excerpt": "Experiments across various benchmark datasets show that D2F achieves a better balance between forgetting and retention than strong baseline methods.",
      "source": "abstract",
      "sourceUrl": "https://arxiv.org/abs/2610.17654v1"
    },
    {
      "signal": "resource_link",
      "label": "材料中提供代码或数据链接（未核验内容）",
      "weight": 2,
      "excerpt": "https://github.com/JingyueCong/D2F",
      "source": "abstract",
      "sourceUrl": "https://arxiv.org/abs/2610.17654v1"
    }
  ],
  "resourceCandidates": [
    "https://github.com/JingyueCong/D2F"
  ],
  "declaredVenue": "26 pages, 6 figures",
  "venueVerified": false,
  "qualityVerified": false
}
