{
  "schemaVersion": 1,
  "id": "arxiv-2610.29385",
  "arxivId": "2610.29385",
  "version": 2,
  "title": "Parallelizable Probabilistic Latent Reasoning for Diverse Reasoning Trajectories",
  "paperUrl": "https://arxiv.org/abs/2610.29385v2",
  "assessedAt": "2026-10-23T07:36:00Z",
  "policyVersion": 5,
  "policyHash": "659a5d53211b260861c9470a895f51e7858b819ececec695c67b89390a51c85c",
  "materialHash": "2f7cf785c94915a3e681d27f5cf4898a12eeb3426ffbe4621497dbaaf9508eb1",
  "materialScope": "abstract_and_arxiv_metadata",
  "decision": "excluded",
  "score": 1,
  "scoreMax": 11,
  "reasons": [
    "材料表明提出方法并使用已有基准评估，未见新基准贡献"
  ],
  "missingSignals": [
    "明确提出新的评测资料或框架",
    "描述任务、问题或评测环境",
    "描述评分指标或评测协议",
    "材料中提供代码或数据链接（未核验内容）",
    "给出任务规模或覆盖范围",
    "讨论泛化、污染、稳健性或人工核验"
  ],
  "evidence": [
    {
      "signal": "baseline_comparison",
      "label": "报告基线或多个模型的评测",
      "weight": 1,
      "excerpt": "Across diverse benchmarks, PLRM achieves performance competitive with deterministic latent reasoning models on single-trajectory datasets while enabling efficient training and consistently outperforming competing stochastic baselines on multi-trajectory datasets.",
      "source": "abstract",
      "sourceUrl": "https://arxiv.org/abs/2610.29385v2"
    }
  ],
  "resourceCandidates": [],
  "declaredVenue": null,
  "venueVerified": false,
  "qualityVerified": false
}
