{
  "schemaVersion": 1,
  "id": "arxiv-2610.12651",
  "arxivId": "2610.12651",
  "version": 1,
  "title": "SynAct: Synergistic Active Feedback Learning for LLM Agents",
  "paperUrl": "https://arxiv.org/abs/2610.12651v1",
  "assessedAt": "2026-10-12T19:50:22Z",
  "policyVersion": 5,
  "policyHash": "659a5d53211b260861c9470a895f51e7858b819ececec695c67b89390a51c85c",
  "materialHash": "7f2426fa5b2dd73559e68e4d8e5851fb5c55e44d9f6468298a9506d33a3c7599",
  "materialScope": "abstract_and_arxiv_metadata",
  "decision": "needs_evidence",
  "score": 4,
  "scoreMax": 11,
  "reasons": [
    "摘要级证据不足以自动收录，保留材料等待补充"
  ],
  "missingSignals": [
    "明确提出新的评测资料或框架",
    "材料中提供代码或数据链接（未核验内容）",
    "给出任务规模或覆盖范围",
    "讨论泛化、污染、稳健性或人工核验"
  ],
  "evidence": [
    {
      "signal": "task_definition",
      "label": "描述任务、问题或评测环境",
      "weight": 1,
      "excerpt": "LLM agents executing multi-step workflows fail in two fundamentally different ways: recoverable slips, which further attempts can repair, and knowledge gaps, which retrying cannot resolve.",
      "source": "abstract",
      "sourceUrl": "https://arxiv.org/abs/2610.12651v1"
    },
    {
      "signal": "evaluation_protocol",
      "label": "描述评分指标或评测协议",
      "weight": 2,
      "excerpt": "Across four agent benchmarks and four models spanning three families, SynAct improves held-out accuracy in all 16 evaluated settings, by +11.7pp on average.",
      "source": "abstract",
      "sourceUrl": "https://arxiv.org/abs/2610.12651v1"
    },
    {
      "signal": "baseline_comparison",
      "label": "报告基线或多个模型的评测",
      "weight": 1,
      "excerpt": "Across four agent benchmarks and four models spanning three families, SynAct improves held-out accuracy in all 16 evaluated settings, by +11.7pp on average.",
      "source": "abstract",
      "sourceUrl": "https://arxiv.org/abs/2610.12651v1"
    }
  ],
  "resourceCandidates": [],
  "declaredVenue": null,
  "venueVerified": false,
  "qualityVerified": false
}
