{
  "schemaVersion": 1,
  "id": "arxiv-2609.28942",
  "arxivId": "2609.28942",
  "version": 1,
  "title": "From Static Personal Values to Contextualized Personalization: Bayesian Personalized Value Alignment for LLMs",
  "paperUrl": "https://arxiv.org/abs/2609.28942v1",
  "assessedAt": "2026-09-29T16:33:57Z",
  "policyVersion": 5,
  "policyHash": "659a5d53211b260861c9470a895f51e7858b819ececec695c67b89390a51c85c",
  "materialHash": "b654861307f7ea4ff79c3dc059e052b98bbf0a24091d5151eab1a2c7d136c83a",
  "materialScope": "abstract_and_arxiv_metadata",
  "decision": "excluded",
  "score": 1,
  "scoreMax": 11,
  "reasons": [
    "材料表明提出方法并使用已有基准评估，未见新基准贡献"
  ],
  "missingSignals": [
    "明确提出新的评测资料或框架",
    "描述任务、问题或评测环境",
    "描述评分指标或评测协议",
    "材料中提供代码或数据链接（未核验内容）",
    "给出任务规模或覆盖范围",
    "讨论泛化、污染、稳健性或人工核验"
  ],
  "evidence": [
    {
      "signal": "baseline_comparison",
      "label": "报告基线或多个模型的评测",
      "weight": 1,
      "excerpt": "Extensive experiments on benchmarks demonstrate its superiority over strong baselines.",
      "source": "abstract",
      "sourceUrl": "https://arxiv.org/abs/2609.28942v1"
    }
  ],
  "resourceCandidates": [],
  "declaredVenue": "29 pages, including references and appendices",
  "venueVerified": false,
  "qualityVerified": false
}
